source,title,link,published,summary
seeking_alpha,Evolution Mining Limited (CAHPF) Shareholder/Analyst Call Transcript,https://seekingalpha.com/article/4845933-evolution-mining-limited-cahpf-shareholder-analyst-call-transcript?source=feed_all_articles,2025-11-20T08:23:27,
seeking_alpha,Seix High Yield Bond SMA Q3 2025 Commentary,https://seekingalpha.com/article/4845953-seix-high-yield-bond-sma-q3-2025-commentary?source=feed_all_articles,2025-11-20T08:15:00,
seeking_alpha,Dividend Yield Vs. Growth Momentum: ICAP In The Era Of Mega-Cap Dominance,https://seekingalpha.com/article/4845966-dividend-yield-vs-growth-momentum-icap-in-era-of-mega-cap-dominance?source=feed_all_articles,2025-11-20T08:15:00,
seeking_alpha,"Global Farm Machinery Makers Face Another Tough Year, But A Turn May Be Coming",https://seekingalpha.com/article/4845963-global-farm-machinery-makers-face-another-tough-year-turn-may-be-coming?source=feed_all_articles,2025-11-20T08:10:00,
seeking_alpha,Zymeworks Inc. 2025 Q3 - Results - Earnings Call Presentation,https://seekingalpha.com/article/4845964-zymeworks-inc-2025-q3-results-earnings-call-presentation?source=feed_all_articles,2025-11-20T08:03:48,
seeking_alpha,K33 AB (publ) (ARCNF) Q3 2025 Earnings Call Prepared Remarks Transcript,https://seekingalpha.com/article/4845957-k33-ab-publ-arcnf-q3-2025-earnings-call-prepared-remarks-transcript?source=feed_all_articles,2025-11-20T08:03:28,
seeking_alpha,Aptera Motors: Another Chance To Sell,https://seekingalpha.com/article/4845950-aptera-motors-stock-another-chance-to-sell?source=feed_all_articles,2025-11-20T07:56:03,
bloomberg,"China Rejects Japan’s Stance on Taiwan, Demands Retraction",https://www.bloomberg.com/news/articles/2025-11-20/china-rejects-japan-s-stance-on-taiwan-demands-retraction,2025-11-20T07:55:59,"China dismissed Japan’s claim that its Taiwan policy is unchanged and repeated its demand that Prime Minister Sanae Takaichi retract her remarks, a sign that tensions between the two countries show li"
